query,answer,reference
how do i get a refund?,"Refunds are processed via the original payment method. For more information visit info@motocura.com. Documents: Documents:  refunds, payments, cancellation, payments and refund process.  Refund process:    Refund Process: 1. Refunds:  1.",Returns & Refunds
how do i get a refund?,motocura.com allows customers to get a refund if they cancel a booking. Refunds are processed via the original payment method. For more information visit info@motocuras.com.,Returns & Refunds
how do i get a refund?,motocura.com is a new booking service. It allows users to get a refund if they cancel their booking. The refund is processed via the original payment method. For more information visit info@motoc,"Returns & RefundsRefund Process 
1.If approved, refund is processed via the original payment method.Q18: Can I get a refund if I cancel my booking?Payments & Refunds 
Q17: How do I make payments?"
